id,nombre
1,Galleta arroz integral c/sal dos hermanos bol 100 grm
2,Galletitas express paq 108 grm
3,Galletitas dulces tita 36 uni est 648 grm
4,Galletitas dulce okebon con lunchera 705 grm
5,Galletitas rellenas pepitos vainilla  paq 384 grm
6,Galletas marinera la bizantina con gluten bsa 180 grm
7,Galletitas de avena quaker c/ chispas de chocola paq 264 grm
8,Galletitas dulces toddy chocochipsmix paq 75 grm
9,Palmeritas don satur paq 180 grm
10,Galletita rellenas smams choc c/ vainilla paq 105 grm
11,Galletitas dulces bauducco cookies original bsa 110 grm
12,Galleta de cereal gall multicere grandiet bsa 100 grm
13,Galletitas dulces soriano pepas paq 400 grm
14,Galletitas dulces terrabusi anillos surtidos paq 160 grm
15,Galletitas dulces tita limon fwp 90 grm
16,Galletas de avena cachafaz chip de chocolate paq 225 grm
17,Galleta martin con gluten paq 160 grm
18,Galletitas rellenas formis zoo black paq 108 grm
19,Galletitas rellenas polvorita paq 80 grm
20,Galletitas dulces gold mundo c/chip d/chocolate paq 200 grm
21,Galletitas dulces ser secas vainilla paq 130 grm
22,Galletitas salvado quaker paq 197 grm
23,Pepas recetas de la abuela arcor bsa 400 grm
24,Galletitas dulces bimbo cookie bar pasas cja 120 grm
25,Galletitas crackers criollitas mas grandes paq 169 grm
26,Galletitas rellenas mana chocolate paq 165 grm
27,Galletitas dulces choco smams paq 150 grm
28,Galletitas rellenas melba angry birds paq 120 grm
29,Galletitas dulces okebon girotondo paq 290 grm
30,Galletitas dulces okebon leche kids paq 140 grm
31,Galletitas crackers criollitas lacteadas paq 354 grm
32,Galletitas crackers express paq 540 grm
33,Galletitas dulces bauducco cookies chocolate bsa 110 grm
34,Galletas de arroz grandiet con sal bsa 100 grm
35,Galletitas rellenas macucas paq 396 grm
36,Galletitas rellenas mana chocol/vainil paq 165 grm
37,Galletitas dulces okebon con chips de chocolate paq 145 grm
38,Galletitas dulces granix limon 7 granos granovita paq 140 gr
39,Galletitas dulces frutigran avena/chips choc. paq 255 grm
40,Galletitas rellenas oreo tripack paq 333 grm
41,Galletitas dulces gold mundo hojaldre paq 150 grm
42,Galletitas rellenas mellizas paq 336 grm
43,Galletitas dulces smams c/chips chocolate paq 180 grm
44,Galletitas dulces kapac pepas libre gluten 200 grm
45,Galletitas club social pizza paq 258 grm
46,Galletitas de avena quaker con pasas paq 256 grm
47,Galletas dulces grandiet miel cja 150 grm
48,Galletitas de salvado bagley fibractive sin sal paq 214 grm
49,Galletitas dulces mana dulce d/leche paq 145 grm
50,Galletitas dulces bimbo cookie bar avena y miel cja 120 grm
51,Galletitas dulces trio pepas tri choc paq 350 grm
52,Galletitas rellenas oreo c/baño choc.blanco cja 204 grm
53,Galletitas dulces polvoron coc smams bsa 130 grm
54,Galletitas dulces okebon vainilla marias paq 145 grm
55,Galletitas rellenas formis dulce de leche paq 72 grm
56,Galletitas dulces cukis mermel de maracuya bsa 180 grm
57,Galletitas dulces formis frutilla paq 324 grm
58,Galletitas dulces fun chips/ chocolate bsa 150 grm
59,Galletas multicereal grandiet dulces bsa 100 grm
60,Vainillas mauri paq 320 grm
61,Galletitas dulces tia maruca palmeritas bol 200 grm
62,Galletitas crackers granix paq 600 grm
63,Galletitas dulces terrabusi variedad nuevo mix paq 600 grm
64,Galletitas surtidas trains jacobsens galletitas cja 200 g
65,Galletitas rellenas oreo paq 117 grm
66,Galletitas dulces trio variette paq 500 grm
67,Galletitas rellenas tentacion mousse chocolate paq 85 grm
68,Pepas brevis paq 400 grm
69,Galletas la bizantina avena lino y chia paq 180 grm
70,Galletitas de avena c/chocolat cereal mix paq 180 grm
71,Galletitas rellenas pepitos vainilla paq 128 grm
72,Galletitas rellenas oreo golden paq 333 grm
73,Galletitas dulces dale maria vainilla paq 435 grm
74,Galletitas dulces pepitos paq 118 grm
75,Galletitas dulces bauducco leche paq 112 grm
76,Galleta arroz integral s/sal dos hermanos bol 100 grm
77,Galletitas dulces smams polvoron vainilla bsa 130 grm
78,Oblea rellena bauducco cookiers n creme paq 130 grm
79,Galletitas de avena quaker con granola paq 249 grm
80,Galletitas crackers paseo sin sal paq 300 grm
81,Galletitas dulces tia maruca pepas bol 250 grm
82,Galletitas dulces hojalmar triangulitos paq 150 grm
83,Galletitas dulces terrabusi variedad chocolate paq 300 grm
84,Galletitas crackers granix lino paq 185 grm
85,Galleta marinera bizantina mate bsa 180 grm
86,Galletitas crackers quaker con miel paq 197 grm
87,Galletitas dulces rhodesia est 220 grm
88,Galletitas de avena quaker con manzana y canela paq 260 grm
89,Galletas dulces grandiet limon cja 150 grm
90,Galletitas de cereal criollitas 3 cer. bol 140 grm
91,Galletitas de sesamo granix sin sal paq 190 grm
92,Galletitas dulces dale maria vainilla paq 170 grm
93,Galletitas dulces terrabusi snacky cubanitos paq 60 grm
94,Galletitas dulces mana vainilla paq 145 grm
95,Oblea rellena bauduco nueces paq 140 grm
96,Vainillas bimbo paq 480 grm
97,Galletitas dulces trio pepas paq 350 grm
98,Galletitas de salvado granix paq 135 grm
99,Galletitas rellenas oreo c/baño chocolate cja 204 grm
100,Galletitas rellenas formis chocolate/vainilla paq 108 grm
101,Galletitas de salvado granix dulce paq 500 grm
102,Oblea rellena bauducco vainilla paq 100 grm
103,Galletitas rellenas formis chocolate paq 72 grm
104,Galletitas dulces kapac vainilla libre gluten 200 grm
105,Oblea rellena bauducco doble chocolate paq 165 grm
106,Galletitas vicenzi  minisnack con crema pastelera est 75 grm
107,Galletas de arroz macrobiotica integral sin sal paq 102 grm
108,Gall.dulces polvoron tia maruca bsa 400 grm
109,Galletitas rellenas toddy mousse dulce de le paq 115 grm
110,Galletitas crackers ser equilibrio paq 360 grm
111,Galletas multicereal grandiet con sal bsa 100 grm
112,Galletas marineras gym sin sal con chia y lino bsa 180 grm
113,Galletitas rellenas formis frutilla paq 72 grm
114,Galletitas dulces pepitos mini bsa 50 grm
115,Pepas don satur bsa 300 grm
116,Gall.rellena vainilla. toddy paq 115 grm
117,Galletitas crackers express light paq 330 grm
118,Galletitas crackers criollitas paq 300 grm
119,Galletitas dulces vocacion fortificada paq 170 grm
120,Oblea rellena bauduco limon paq 140 grm
121,Galletitas rellenas oreo vainilla chocolate paq 150 grm
122,Galletitas dulces okebon panal chocolate paq 280 grm
123,Galletitas dulces gold mundo palmeritas paq 250 grm
124,Galletitas dulces gold mundo anillo vainilla paq 250 grm
125,Galletas marineras gym con sal bol 200 grm
126,Galletitas crackers sin sal granix paq 555 grm
127,Galletitas dulces  toddy chocochips mix paq 210 grm
128,Galletitas dulces rhodesia 4 uni paq 88 grm
129,Galletitas dulces okebon avena granola paq 165 grm
130,Galletitas rellenas pepitos chantilly/chocolat paq 128 grm
131,Galletittas dulces pepitos sticks bsa 150 grm
132,Vainilla mauri paq 160 grm
133,Galletitas dulces tia maruca tortitas bol 200 grm
134,Galletitas rellenas mana vainilla/frutilla paq 165 grm
135,Galletitas dulces arcor saurios bsa 160 grm
136,Galletitas crackers criollitas mas grandes paq 507 grm
137,Galletas avena cachafaz pasas de uva  paq 225 grm
138,Galetitas dulces granix coco 7 granos granovita paq 140 grm
139,Galletitas dulces cerealmix granola y manzana paq 180 grm
140,Vainillas coto paq 500 grm
141,Galletitas rellenas rumba paq 336 grm
142,Galletitas dulces okebon panal chocolate paq 160 grm
143,Galletitas dulces okebon almendra y chia paq 165 grm
144,Galletas marinera la bizantina avena y sesamo paq 180 grm
145,Galletitas dulces gold mundo larguitas paq 200 grm
146,Galletitas dulces terrabusi variedad nuevo mix bsa 400 grm
147,Galletitas rellenas oreo paq 111 grm
148,Galletitas dulces okebon frutos rojos paq 255 grm
149,Galletas marineras la bizantina sin sal bsa 180 grm
150,Oblea rellena rhodesia mini paq 60 grm
151,Oblea rellena bauducco chocol. con avellana  paq 165 grm
152,Galletitas dulces pepitos tripack paq 354 grm
153,Galletitas dulces okebon panal miel paq 165 grm
154,Galletitas cereales y frutas tropical vitagran paq 250 grm
155,Galletitas rellenas polvorita chocolate paq 80 grm
156,Galleta arroz integral dulce dos hermanos bol 100 grm.
157,Galletas marinera la bizantina con salvado bsa 180 grm
158,Galletitas de salvado quaker paq 591 grm
159,Galletitas dulces okebon leche f.plus paq 290 grm
160,Galletitas rellenas mellizas paq 112 grm
161,Vainillas coto paq 170 grm
162,Biscuits smams artesanales paq 120 grm
163,Galletitas rellenas sonrisas frambuesa paq 118 grm
164,Galletitas dulce soriano hojaldre larguitas paq 200 grm
165,Mermelada bonne maman frutilla fra 370 grm
166,Galletitas crackers express sin sal familiares paq 360 grm
167,Galletitas de salvado ser paq 145 grm
168,Galletitas dulces pepitos chocolate sticks bsa 52 grm
169,Galletitas dulces okebon leche c/cerea forti plus paq 165 grm
170,Galletitas dulces cukis mermel de arandano bsa 180 grm
171,Galletitas dulces polvoron marmolada bsa 300 grm
172,Galletitas dulces fun rosquillas bsa 150 grm
173,Galletitas dulces pepitos tortitas paq 124 grm
174,Galetitas crackers paseo 5 semillas paq 300 grm
175,Galletas frutigran granola coco y almendras paq 145 grm
176,Galletitas rellenas formis dulce de leche paq 108 grm
177,Galletitas dulces hojalmar larguitas paq 150 grm
178,Galletitas crackers quaker 7 cereales paq 197 grm
179,Galletitas de cereales y chips chocolate vitagran paq 250 grm
180,Galletitas de salvado granix paq 235 grm
181,Galleta c/gluten tia maruca bsa 180 grm
182,Galletitas dulces okebon panal limon paq 160 grm
183,Galletitas rellenas oreo chocolate paq 111 grm
184,Rosquitas gold mundo con chip chocolate bsa 300 grm
185,Galletitas dulces toddy c/chips choc extra paq 100 grm
186,Vainillas tia maruca paq 160 grm
187,Galletitas dulces quaker secas avena con granola paq 187 grm
188,Galletitas dulces golci pepas bol 150 grm
189,Galletas marineras gym salvado bol 200 grm
190,Galletitas dulces gold mundo bol 400 grm
191,Galletitas dulces okebon avena granola paq 255 grm
192,Galletitas dulces cukis merme de frambuesa bsa 180 grm
193,Galletitas dulces mana limon paq 145 grm
194,Galletitas rellenas tita limon est 216 grm
195,Galletitas dulces rococo paq 160 grm
196,Oblea rellena bauducco maxi chocolate paq 130 grm
197,Galletitas rellenas sonrisas picaras frambuesa paq 84 grm
198,Galletitas dulces okebon leche con forti plus paq 165 grm
199,Galletitas dulces pepitos con chips chocolate bsa 150 grm
200,Galletas frutigran granola cacao y avellana paq 142 grm
201,Galletitas dulces okebon panal coco paq 160 grm
202,Galletas club social jamon paq 258 grm
203,Galletitas avellanas jacobsens baker shop cja 200gr
204,Galletitas rellenas tortitas chocolate paq 125 grm
205,Galletitas crackers mediatarde paq 321 grm
206,Galletitas avellanas jacobsens cja 200 grm
207,Gall.dulces choco 210g toddy paq 210 grm
208,Grisines clasicos paseo paq 180 grm
209,Galletas de arroz macrobiotica dulce paq 102 grm
210,Galletitas crackers paseo paq 300 grm
211,Galletitas crackers argentitas paq 306 grm
212,Oblea rellena bauducco chocolate paq 100 grm
213,Oblea rellena opera paq 55 grm
214,Galletitas crackers media tarde paq 110 grm
215,Galletita de cereal cereal mix aventa frutilla paq 230 grm
216,Galletitas dulces soriano hojaldre triangulo paq 200 grm
217,Galletitas rellenas polvorita choc c/vainilla paq 150 grm
218,Galletitas dulces arcor pepas recetas d/abuela paq 200 grm
219,Oblea rellena opera paq 220 grm
220,Galletitas marinera gym chia y lino bsa 180 grm
221,Galletitas rellenas polvorita frutilla paq 80 grm
222,Galletitas crackers sin sal criollitas paq 507 grm
223,Galletitas crackers traviata paq 303 grm
224,Galletitas crackers sin sal argentitas paq 480 grm
225,Galletitas dulces urquiza merengues paq 150 grm
226,Galletitas dulces gold mundo rosquitas paq 500 grm
227,Galletas marineras gym light paq 200 grm
228,Galletas marineras paseo mini paq 220 grm
229,Galletitas crackers traviata pack 5 uni paq 505 grm
230,Galletita rellena smams vainilla c/ frutil paq 105 grm
231,Galletitas dulces formis chocolate paq 324 grm
232,Galletitas dulces gold mundo limon anillos bol 250 grm
233,Galletitas dulces arcor chocochips paq 135 grm
234,Vainillas pozo paq 480 grm
235,Galletitas crackers criollitas paq 500 grm
236,Galletitas dulces mana coco paq 145 grm
237,Galletitas dulces bauducco c/chocolate paq 112 grm
238,Galletitas rellenas rumba bagley paq 112 grm
239,Galletitas rellenas formis frutilla/vainilapaq 108 grm
240,Galletitas rellenas tentacion frutilla paq 85 grm
241,Galletitas secas cerealitas avena y chocolate paq 231 grm
242,Galletitas mix de cereales hogareñas paq 176 grm
243,Galletitas dulces variedad dorada bsa 300 grm
244,Galletitas dulces pepitos chips blancos paq 125 grm
245,Galletitas dulces okebon almendras y chia paq 255 grm
246,Galletitas dulces melitas paq 170 grm
247,Galletitas dulces okebon brios c/chispas paq 300 grm
248,Galletitas de cereal granix paq 185 grm
249,Galletas de avena cachafaz almendra y mani paq 225 grm
250,Galletitas dulces lincoln clasica paq 153 grm
251,Galletitas dulces okebon avena y cacao paq 165 grm
252,Galletitas crackers mayco paq 516 grm
253,Galletitas rellenas polvorita frutilla fresa paq 150 grm
254,Galletitas rellenas duquesa vainilla paq 115 grm
255,Galletitas de salvado cerealitas paq 606 grm
256,Galletitas dulces coquitas paq 170 grm
257,Galletitas mix de cereales hogareñas paq 528  grm
258,Galletitas crackers criollitas paq 100 grm
259,Galletitas crackers sin sal criollitas paq 169 grm
260,Galletitas rellenas tortitas black paq 125 grm
261,Galletitas dulces okebon avena y cacao paq 255 grm
262,Vainillas valente paq 160 grm
263,Pepas clasicas de membrillo trio paq 500 grm
264,Galletitas dulces kapac scones vainilla est 200 grm lib glute
265,Galletitas rellenas merengadas frutilla paq 93 grm
266,Galletitas dulces cereal mix avena y pasas paq 230 grm
267,Galletitas dulces arcor diversion paq 400 grm
268,Galletitas crackers express paq 324 grm
269,Vainillas valente paq 480 grm
270,Galletitas rellenas oreo mini chocolate paq 50 grm
271,Oblea rellena mini rhodesia terrabusi bañada ch bsa 150grm
272,Galletitas rellenas amor paq 336 grm
273,Oblea de arroz gallo snacks paq 60 grm
274,Galletitas dulces la cumbre frutas citricas bsa 170 grm
275,Galletitas dulces granix surtidas avena/miel paq 350 gr
276,Galletitas dulces quaker secas avena con pasas paq 187 grm
277,Galletitas dulces polvoron lim smams bsa 130 grm
278,Galletitas dulces okebon pescadito paq 200 grm
279,Galletitas dulces okebon leche c/miel f.plus paq 290 grm
280,Galletitas dulces frutigran semillas girasol paq 260 grm
281,Galleta light tia maruca bsa 180 grm
282,Galletitas crackers media tarde paq 330 grm
283,Galletas dulces grandiet chocolate cja 150 grm
284,Galletitas de salvado bagley fibractive paq 642 grm
285,Galletitas de cereal okebon molino natura 10 sem paq 165 g
286,Oblea rellena nesquik c/cobertur chocolat paq 23 grm
287,Galletitas crackers ciudad del lago paq 330 grm
288,Galletas marineras  la bizantina con sal bsa 180 grm
289,Galletitas rellenas amor paq 112 grm
290,Galletitas rellenas toddy chocolate paq 348 grm
291,Oblea rellena bauducco chocolate paq 140 grm
292,Galletitas de cereal cerealitas clasicas paq 600 gr
293,Mermelada bonne maman durazno fra 370 grm
294,Galletitas dulces okebon leche chocolatada f.plus paq 290 grm
295,Galletitas dulces okebon chips blancas paq 145 grm
296,Galletas de arroz macrobiotica con sal paq 102 grm
297,Galletitas de cereal okebon molino natura 10 sem paq 255 g
298,Galletitas rellenas merengadas paq 279 grm
299,Galletitas rellenas oreo golden paq 111 grm
300,Galletitas dulces soriano palmeritas paq 250 grm
301,Galletas marinera la bizantina light bsa 180 grm
302,Galletitas dulces gold mundo anillos coco paq 250 grm
303,Galletas de arroz grandiet dulces bsa 100 grm
304,Galletas de arroz breviss light paq 110 grm
305,Galletas de arroz arrocitas 3 cereales paq 101 grm
306,Galletitas dulces vocacion acarameladas paq 450 grm
307,Galletitas rellenas mana limon/limon paq 165 grm
308,Galletita rellena smams vainilla c/ vainil paq 105 grm
309,Galletitas dulces mana vainilla pack x 3 paq 393 grm
310,Galletitas dulces trio con dulce de batata bsa 300 grm
311,Galletitas dulces frutigran frutas tropicales paq 250 grm
312,Galletitas de sesamo granix paq 185 grm
313,Galletitas crackers paseo mix de cereales paq 300 grm
314,Galletitas dulces frutigran semillas lino paq 240 grm
315,Galletitas dulces tia maruca anillos limon bsa 400 grm
316,Galletitas dulces tia maruca varitas hojaldre paq 200 grm
317,Galletitas de avena y pasas granix frutigran paq 250 grm
318,Galletitas crackers ser equilibrio paq 120 grm
319,Oblea rellena nesquik c/leche 3 uni paq 69 grm
320,Galletita rellena celebration chocolate con leche cja 270 g
321,Galletitas rellenas cindor paq 120 grm
322,Galletitas dulces okebon chocolate marias paq 145 grm
323,Galletitas rellenas pepitos vainilla/chocolate paq 384 grm
324,Galletitas dulces pepitos chips blancos paq 375 grm
325,Galletitas dulces okebon naranja y chocola paq 255 grm
326,Galletitas dulces terrabusi habanitos paq 60 grm
327,Galletitas dulces chocolinas paq 250 grm
328,Galletitas dulces rhodesia est 792 grm
329,Galletas de arroz grandiet integral sin sal bsa 100 grm
330,Galletas dulces grandiet coco cja 150 grm
331,Galletitas dulces arcor medialunas paq 200 grm
332,Galletitas dulces chocolinas paq 170 grm
333,Gall.cereal 7 semillas arcor paq 181 grm
334,Galletitas dulces toddy con chips de chocolate paq 75 grm
335,Gall.dulces chocolat toddy paq 75 grm
336,Galletitas rellenas polvorita vainilla  paq 150 grm
337,Galletitas crackers granix granagua paq 200 grm
338,Galletitas crackers traviata paq 101 grm
339,Galletitas dulces gold mundo choco y vai paz y amor 400 grm
340,Galletitas dulces granix salvado frutigran paq 250 grm
341,Pepas cukis con mermelada membrillo paq 380 grm
342,Galletas marineras gym sin sal paq 200 grm
343,Galletitas dulces bauducco coco paq 118 grm
344,Galleta marinera la bizantina avena y girasol paq 180 grm
345,Galletitas de sesamo hogareñas paq 167 grm
346,Oblea rellena bauducco vainilla paq 140 grm
347,Galletitas crackers criollitas lacteadas paq 118 grm
348,Galletitas crackers mayco salvado paq 633 grm
349,Gallettas dulces lincoln chocolate paq 459 grm
350,Galletitas de salvado hogareñas 7 semillas paq 543 g
351,Galletitas dulces terrabusi habanitos baña cho bsa 150grm
352,Galletitas dulces arcor cereal avena y pasas paq 180 grm
353,Galletitas la cumbre dulces con limon bsa 170 grm
354,Galletitas dulces quaker secas avena con manzana paq 187 grm
355,Oblea rellena opera paq 92 grm
356,Galletitas dulces okebon leche c/cerea f.plus paq 290 grm
357,Galletitas dulces martin leche paq 265 grm
358,Galletitas dulces granix 7gran algarroba granovita paq 140 g
359,Galletitas dulces bagley surtido paq 400 grm
360,Oblea rellena bauducco dulce de leche paq 140 grm
361,Galletitas dulces toddy con chips de chocolate paq 210 grm
362,Galletitas dulces trio frolitas paq 300 grm
363,Galletitas dulces frutigran granix aven/pas.uva paq 500 gr
364,Galletitas dulces tia maruca anillos coco bol 250 grm
365,Galletitas crackers sin sal granix paq 120 grm
366,Galletitas crackers media tarde paq 535 grm
367,Galletitas dulces gold mundo polvorones paq 200 grm
368,Galletitas dulces breviss vainilla bsa 250 grm
369,Galletitas dulces cereal mix semillas y chips paq 280 grm
370,Galletitas dulces dulcypas pepas bsa 400 grm
371,Galletitas de salvado hogareñas paq 600 grm
372,Galletitas rellenas bauducco vainilla paq 120 grm
373,Galletitas dulces formis choc/ dulce de leche paq 324 grm
374,Oblea rellena opera triple naranja / frutilla paq 75 grm
375,Galletita marinera maiz la bizantina bsa 180 grm
376,Galletitas dulces cerealitas granola paq 231 grm
377,Galletitas dulces dale maria vainilla con leche paq 140 grm
378,Galletitas dulces lincoln coco paq 153 grm
379,Galletitas dulces okebon panal vainilla paq 280 grm
380,Galletita club social original paq 258 grm
381,Galletitas de salvado hogareñas paq 200 grm
382,Galletitas dulces lincoln paq 459 grm
383,Galletitas dulces gold mundo pepas paq 500 grm
384,Oblea rellena bauducco fresa paq 140 grm
385,Opera rellena opera bañada en chocolate paq 27 grm
386,Galletitas dulces fun fantoche bañadas en choco bsa 120 grm
387,Galletitas dulces manon leche paq 178 grm
388,Galletitas de salvado bagley fibractive paq 214 grm
389,Oblea blanca bon o bon bli 30 grm
390,Oblea rellena opera clasica paq 75 grm
391,Galletitas rellenas sonrisas frambuesa paq 354 grm
392,Yerba mate la tranquera con palo  paq 500 grm
393,Te patagonia f.tea verde est 20 saq
394,Cafe soluble la morenita torrado fra 100 grm
395,Te taragui verde est 20 saq
396,Te saint gottard verde menta y miel est 25 saq 1.8 grm
397,Te en hebras chinnamon & roseh delhi tea doy 100 grm
398,Yerba mate taragui +energia paq 500 grm
399,Te la morenita boldo est 20 saq
400,Chocolate para taza aguila tab 150 grm
401,Te la tranquera clásico cja 25 sob 50 grm
402,Cafe vainilla cabrales senseo bsa 112 grm
403,Cafe en bolsitas colombia cabrales senseo bsa 112 grm
404,Te en hebras chinese green tea delhi tea lat 100 grm
405,Te taragui clasico internacional est 25 saq
406,Te taragui dargeeling internacional est 25 saq
407,Cafe molido bonafide torrado suave paq 125 grm
408,Cappuccino la virginia instantaneo fra 210 grm
409,Cappuccino arlistan cremoso cja 125 grm
410,Cafe molido tostado la jocoba bsa 250 grm
411,Te la morenita manzanilla est 20 saq
412,Mate cocido union ensobrado est 20 saq
413,Te saint gottard selecciã³n de sabores cja 20 saq
414,Te taragui verde con menta est 20 saq
415,Yerba mate cachamate siluet plus paq 500 grm
416,Cafe molido coto paq 500 grm
417,Yerba mate union con palo origen con paq 1000 grm
418,Cafe soluble nescafe dolca latte fra 160 grm
419,Te celestial s. manzanilla miel y vainilla cja 10 saq
420,Capuccino la virginia espuma de vainilla fra 155 grm
421,Cafe soluble nescafe dolca cappuccino fra 150 grm
422,Te delhi tea chocolate temptation est 20 sob
423,Café molido martinez italiano ilustrado lat 250 grm
424,Yerba mate cruz de malta ecopack paq 1 kg
425,Cappuccino la morenita fra 130 grm
426,Cafe en bolsita super cabrales senseo bsa 112 grm
427,Te taragui ceylon internacional est 25 saq
428,Cafe en bolsita torrado cabrales senseo bsa 112 grm
429,Yerba mate la tranquera con palo paq 1000 grm
430,Cafe molido cabrales super paq 500 grm
431,Yerba mate taragui bcp origen controlado paq 1 kg
432,Te de tilo la morenita est 20 saq
433,Yerba mate taragui sin palo paq 500 grm
434,Te saint gottard naranja y pomelo cja 20 saq
435,Mate listo taragui 720 cc termo+mate+bombilla+azucar
436,Te la virginia mezcla de hierbas alimonada 25 saq 25 gr
437,Cafe molido bonafide torrado intenso paq 250 grm
438,Cafe molido la virginia equilibrado paq 1 kg
439,Café instantaneo torrado selec arlistan fra 100 grm
440,Cafe en grano los 5 hispanos bsa 1 kgm
441,Te virgin islands clasico est 25 saq
442,Capsulas cappuccino nescafe dolce gusto cja 200grm
443,Te celestial s. country peach passion cja 10 saq
444,Te saint gottard tilo cja 15 grm
445,Cafe instantaneo la virginia granulado fra 170 grm
446,Te taragui placeres 6 variedades cja 40 grm
447,Cafe soluble nescafe espresso fra 100grm
448,Te la virginia rojo 20 saq est 30 grm
449,Te helado saint gottard frutos rojos paq.40 grm 20 uni
450,Te saint gottard menta est 15 saq
451,Mate cocido union filtro filtr diamantado 25 saq cja 75 grm
452,Te celestial s. moras silvestres cja 10 saq
453,Te coto premium 25 saq cja 50 grm
454,Yerba mate cbse hierbas cuyanas paq 500 grm
455,Te rooibos fruta delhi tea est 20 sob
456,Te la virginia molienda controlada est 25 saq 50 grm
457,Yerba mate cachamai tilo paq 500 grm
458,Te taragui blend especial cja 75 saq
459,Te heredia mezcla de hierbas noche est 25 saq
460,Te taragui earl grey internacional est 25 saq
461,Yerba mate la merced con palo campo y monte est 500 grm
462,Malta el pocillo fra 170 grm
463,Cacao chocolino plus bsa 360 grm
464,Yerba mate la cumbrecita paq 500 grm
465,Yerba mate las marias con palo aniversario lat 500 grm
466,Chocolate para taza aguila tab 100 grm
467,Cacao nesquik instantaneo chocolatado bsa 360 grm
468,Yerba mate union con palo origen con paq 500 grm
469,Yerba mate cachamate naranja suave  paq 500 grm
470,Mate cocido union filtro diamantado 100 saq cja 300 grm
471,Te taragui verde est 40 saq
472,Te cachamai verde clasico cja 20 saq 2 grm
473,Te heredia de hierbas cja 43 grm
474,Te de frutas durazno y maracuy saint gottard  cja 20 saq
475,Yerba mate cbsé hierbas del litoral paq 500 grm
476,Te la virginia mezcla de hierbas mentolada 25 saq 25grm
477,Te la virginia hierbas boldo est 25 saq
478,Cappuccino lavirginia mousse de chocolate y ave fra 155 grm
479,Te en hebras chinnamon & roseh delhi tea lat 100 grm
480,Te la virginia con limon y vitamina c est 20 sob
481,Te taragui tilo est 10 saq
482,Te saint gottard boldo  y menta cja 30 grm
483,Cafe molido bonafide torrado intenso paq 500 grm
484,Yerba mate verde flor melisa paq 500 grm
485,Te taragui  boldo hierbas silvestre cja 50 uni 50 grm
486,Yerba mate rosamonte especial paq 1 kgm
487,Yerba mate cbse frutos del valle paq 500 grm
488,Te chamana hier rooiboscan jengciruehigo ens est 15 saq
489,Mate cocido crysf est 25 saq
490,Cafe instantaneo la virginia granulado fra 100 grm
491,Te la virginia molienda controlada est 50 saq 100 grm
492,Cafe soluble cabrales cappuccino pou 125 grm
493,Te chamana seleccion de hierbas ensob est 15 saq
494,Cafe capsula nescafe dolca caramel cja 83 grm
495,Mate cocido taragui ensobrado est 40 saq
496,Yerba mate canarias paq 1 kgm
497,Yerba mate c/palo rosamonte paq 500 grm
498,Te heredia rosa est 25 saq
499,Cafe instantaneo nescafe dolca suave fra 170 grm
500,Te cachamai boldo est 20 saq
501,Yerba mate hiebas silvestre compuesta suave bsa 500 grm
502,Te en hebras chinese green tea delhi tea doy 50grm
503,Cafe soluble capucci. cabrales fra 210 grm
504,Yerba mate comun rosamonte paq 2 kgm
