id,nombre
9924,Vino tinto gala 2 bot 750 cc
9925,Caipiriña american club bot 750 cc
9926,Vino cabernet sauvignon terrazas reserva bot 750 cc
9927,Vino malbec santa isabel bot 700 cc
9928,Champaña extra brut chandon bot 375 cc pak 2 uni
9929,Vino malbec san huberto centenario bot 750 cc
9930,Vino malbec  alaris trapiche bot 187 cc
9931,Licor bols premium frutilla bot 700 ml
9932,Vino tinto paisaje de tupungato bot 750 cc
9933,Vino borgoña san huberto bot 1.5 ltr
9934,Champaña extra brut mercier bot 750 cc
9935,Tequila sol azteca bot 1 lt
9936,Vino chardonnay finca natalina bot 750 cc
9937,Vino cabernet sauvignon la flor de pulenta bot 750 cc
9938,Vino cabernet sauvignon altas cumbres bot 750 cc
9939,Licor bols dulce de leche bot 700 cc
9940,Vino cabernet sauvignon c.de la cepa prem bot 750 cc
9941,Vino syrah-bonard valderrobles var. europeos mgn bot 1125 cc
9942,Vino malbec peq. producciones bot 750 cc
9943,Vino malbec yauquen bot 750 cc
9944,Champaña nature baron b premium bot 750 cc
9945,Vino syrah quara bot 750 cc
9946,Espumante blanco septiembre bot 750 cc
9947,Vino chardonnay viogner emilia nieto senetiner bot 750 cc
9948,Vino blanco lopez seleccion bot 750 cc
9949,Vino torrontes quara bot 750 cc
9950,Whisky white horse bot 750 cc
9951,Vino cabernet sauvignon etnia varietal bot 750 cmq
9952,Vino syrah colon bot 750 cc
9953,Licor luxardo amaretto bot 750 cc
9954,Champaña extra brut feder.de alvear bot 750 cc
9955,Vino torrontes don david bot 750 cc
9956,Vino cabernet sauvignon suter bot 750 cc
9957,Espumante rosado new age bot 750 cc
9958,Vino cabernet sauvignon san felipe roble bot 750 cc
9959,Vino malbec rose saurus bot 750 cc
9960,Vino tinto hereford bot 750 cc
9961,Vino cabernet/syrah nieto senetiner  bot 750 cc
9962,Cerveza corona por 325 cc
9963,Licor drambuie crema a/whisky estuche bot 750 cc
9964,Licor cusenier chocolate bot 700 cc
9965,Vino malbec hereford cja 3 ltr
9966,Vino cabernet sauvignon cafayate reserve bot 750 cc
9967,Vino cabernet sauvignon finca natalina roble bot 750 cc
9968,Cerveza miller pack lat 4 uni 473 ml + set 2 parlt
9969,Champaña extra brut toso champenoise bot 750 cc
9970,Vino tinto numina salentein bot 750 cc
9971,Jerez federico lopez bot 750 cc
9972,Vino malbec fond de cave reserva bot 750 cc
9973,Vino chardonnay killka bot 750 cc
9974,Champaña extra brut saurus bot 750 cc
9975,Vino tinto toro dulce ttb 1 ltr
9976,Vino blanco suc.a.m.torino bot 700 cc
9977,Vino blanco goyenechea brut bot 750 cc
9978,Vino malbec cruz alta bot 750 cc
9979,Vino cab sau + malbec joven san huberto est 2 u bot 750 cc
9980,Vino malbec navarro correas bot 750 cc
9981,Vino cabernet sauv. - merlot infinitus bot 750 cc
9982,Licor el abuelo maracuya bot 700 cc
9983,Champaña grande cuvee krug estuche 1 uni est 750 cc
9984,Vino malbec rutini apartado gran malbec bot 750 cc
9985,Vino viognier dulce alma mora bot 750 cc
9986,Espumante sua fresa bot 750 cc
9987,Vino syrah finca natalina roble bot 750 cc
9988,Champaña extra brut trapiche bot 750 cc
9989,Espumante blanco frizze bot 750 cc
9990,Champagne alma mora extra brut champagne e/b x 750 ml
9991,Vino syrah omnium bot 750 cmq
9992,Vino tinto cheval d/andes bot 750 cc
9993,Vino malbec malma reserva bot 750 cc
9994,Vino cabernet-malbec nina estuche bot 750 cc
9995,Vino syrah-tempranillo los pasos bot 750 cc
9996,Vino red blend nicasia caberne franc/merl/verdot bot 750 cc
9997,Champaña nature trapiche brut bot 750 cc
9998,Vino malbec esmeralda fernandez bot 750 cc
9999,Vino cabernet sauvignon humberto canale bot 750 cc
10000,Vino malbec enrique foster bot 375 cc
10001,Vino bonarda colon bot 750 cc
10002,Vino chardonnay uxmal bot 750 cc
10003,Champaña nature navarro correas premium bot 750 cc
10004,Vino chardonnay goyenechea bot 750 cc
10005,Espumante frezze new touch maracuya bot 750 ml
10006,Champaña délice chandon bot 375 ml
10007,Vino f.rosad malbec - varie nolita bot 750 ml
10008,Vino syrah-bonard valderrobles var. europeos bot 700 cc
10009,Vino cabernet sauvignon malma clasico bot 750 cc
10010,Vino malbec enrique foster edicion limitada bot 750 cc
10011,Vino malbec territorio bot 750 cc
10012,Vino tinto montchenot bot 750 cc
10013,Vino malbec malbec dv catena bot 750 cc
10014,Vino malbec kinien bot 750 cc
10015,Cerveza budweiser bot 970 cc
10016,Champaña extra brut santa julia bot 750 cc
10017,Vino cabernet sauvignon bodega fdm bot 750 cc
10018,Vino cabernet sauvignon callia reserve bot 750 cc
10019,Vino malbec circus roble bot 750 cc
10020,Vino sauvignon blanc f.d.cave reserva bot 750 cc
10021,Champaña demi sec x freixenet bot 750 cc
10022,Vino torrontes michel torino bot 700 cc
10023,Sidra victoria etiqueta blanca bot 720 cc
10024,Vino tinto hereford mejor ejemplar bot 750 cc
10025,Champaña brut nature amalaya bot 750 ml
10026,Vodka orloff bot 1 ltr
10027,Gin burnett`s bot 1 ltr
10028,Vino malbec intimo bot 750 cc
10029,Mer/malb/cab-mal c/est rutini est 3 uni
10030,Champaña extra brut norton bot 187 cc pack x4 uni
10031,Vino malbec trivento golden reserve bot 750 ml
10032,Vino cabernet sauvignon benmarco bot 750 cc
10033,Vino malbec michel torino coleccion bot 750 cc
10034,Cerveza estrella damm bot 330 cc
10035,Vino malbec y bonarda emilia nieto senetiner bot 750 cc
10036,Vino merlot nieto senetiner bot 750 cc
10037,Cerveza budweiser pak 6 uni lat 473 cmq
10038,Vino merlot finca los maza coleccion bot 750 cc
10039,Vino valmont cabernet-malbec-mer bot 750 cc
10040,Vodka oddka twisted melon bot 750 ml
10041,Champaña extra brut maria codorniu bot 750 cc
10042,Cerveza brahma bot 1 lt
10043,Licor american club frutilla bot 750 cc
10044,Vino cabernet sauvignon omnium bot 750 cc
10045,Espumante blanco alma 4 chardonnay roble bot 750 cc
10046,Vino tinto viñas de alvear bot 12 ltr
10047,Vodka ciroc bot 750 cc
10048,Champaña extra brut finca la linda bot 750 cc
10049,Cerveza negra stella artois noire bot 975 cmq
10050,Espumante orange evolution frizze bot 750 cc
10051,Vino malbec rosado san felipe roble bot 750 cc
10052,Vino cabernet sauvignon encuentro bot 750 cc
10053,Vino malbec heritage la celia bot 750 cc
10054,Vino cabernet sauvignon emilia bot 750 ml
10055,Vino chablis bianchi bot 700 cc
10056,Vino cabernet sauvignon septima bot 750 cc
10057,Champaña brut nature d.v. catena bot 750 cc
10058,Vino blanco valderrobles dulce natural bot 700 cc
10059,Vino rosado amalaya bot 750 cc
10060,Vino rosado postales fdm bot 750 cc
10061,Cerveza patagonia kunè bot 710 cmq
10062,Vino chardonnay esmeralda fernandez bot 750 cc
10063,Vino malbec  alaris trapiche bot 750 cc
10064,Champaña nature chandon premium bot 750 cc
10065,Vino chardonnay-semillon comte valmont bot 750 cc
10066,Vino merlot callejon crimen bot 750 cc
10067,Vino tempranillo colon bot 750 cc
10068,Vino red blend nicasia malb/cabsau/verdot bot 750cmq
10069,Aperitivo gancia red bitter bot 750 cmq
10070,Vino tinto viñas de  orfila seleccion bot 700 cc
10071,Champaña extra brut uno santa julia bot 187 cc
10072,Vino cabernet sauvignon kaiken ultra bot 750 cc
10073,Whisky teachers est bot 750 cc
10074,Champaña demi sec mercier bot 750 cc
10075,Vino malbec rosado el portillo bot 750 cc
10076,Americano gancia limòn one lat 354 cc
10077,Vino rosado toro viejo bot 700 cc
10078,Vino sauvignon blanc killka bot 750 ml
10079,Vino cabernet sauvignon luigi bosca bot 750 cc
10080,Vino rosado benjamin coleccion tardia bot 750 cc
10081,Vino merlot rosado goyenechea bot 750 cc
10082,Vino chenin suter bot 750 cc
10083,Vino cabernet sauvignon carcassonne 1884 bot 750 cc
10084,Vino cabernet-malbec san huberto bot 750 cc
10085,Vino cabernet-malbec est. mendoza bot 750 cc
10086,Vino malbec altosur cosecha 2003 bot 750 cc
10087,Vino malbec bianchi doc bot 750 cc
10088,Americano gancia one berry lat 354 cc
10089,Licor al whisky cafe tres plumas bot 750 cc
10090,Cerveza palermo bot 970 cc
10091,Kirschawasser luxardo bot 750 cc
10092,Whisky ballantines est  bot 750 cc
10093,Americano marcela bot 930 cc
10094,Vino chardonnay casona lopez bot 750 cc
10095,Vino malbec terra roble bot 750 cc
10096,Licor bols blue curacao bot 750 cc
10097,Champaña pommery brut rose bot 750 cc
10098,Vino malbec estate colome bot 750 cc
10099,Vino sauvignon blanc rutini bot 750 cc
10100,Vino chablis santa isabel bot 750 cc
10101,Vino cab sau + malbec nieto senetiner est 2 uni
10102,Fernet ramazzotti bot 750 cc
10103,Vino torrontes coquena bot 750 cc
10104,Champaña rose alma negra bot 750 cc
10105,Cerveza negra corona porron 330 cc
10106,Vino blanco viñas de alvear bot 12 ltr
10107,Vino tinto norton cosecha tardia dulce nat bot 750 ml
10108,Vino white blend imago bot 750 ml
10109,Vino syrah valbona bot 750 cc
10110,Ron santa teresa 1796 antiguo de solera lat 700 cc
10111,Vino torrontes colome bot 750 cc
10112,Cerveza estrella galicia bot 330 cc
10113,Champaña demi sec norton bot 750 cc
10114,Vino malbec rosado emilia nieto senetiner bot 750 cc
10115,Vino tinto vasco viejo bot 750 cc
10116,Vino merlot lagarde bot 750 cc
10117,Cerveza schneider bot 970 cc
10118,Champaña nature trumpeter brut bot 750 cc
10119,Vino malbec finca ñ freixenet bot 750 cc
10120,Vino malbec-bonarda uxmal bot 750 cc
10121,Vino cabernet- franc-merlot la poderosa bot 750 ml
10122,Vino cabernet sauvignon  alaris trapiche bot 750 cc
10123,Champaña extra brut chandon magum bot 15 ltr
10124,Whisky johnnie walker swing est bot 750 cc
10125,Vino tinto termidor seleccion ttb 1 ltr
10126,Espumante blanco frizze durazno new touch bot 750 cc
10127,Vodka burnett`s bot 1 lt
10128,Vino sauvignon blanc saint felicien bot 750 cc
10129,Vino blanco dulce rumbos santa ana bot 750 cc
10130,Vino syrah latitud 33º bot 750 cc
10131,Vino syrah norton roble bot 750 cc
10132,Vino tinto  cab/malbec dv catena est 2 uni 750cc
10133,Champaña extra brut maria codorniu est 750 cc
10134,Licor bols cognac bot 750 cc
10135,Licor american club peach colada bot 750 cc
10136,Cerveza imperial lager bot 1 lt
10137,Vino blend . altosur bot 750 ml
10138,Moscato crotta bot 930 cc
10139,Licor bols advokaat bot 700 cc
10140,Vino malbec quinta generac. bot 750 cc
10141,Vino malbec finca domingo bot 750 cc
10142,Vino malbec bianchi leo bot 750 cc
10143,Cerveza kunstmann bot 330 cc
10144,Vino malbec tocornal bot 750 ml
10145,Espumante rosado deseado rose bot 750 ml
10146,Vino torrontes etchart privado bot 750 cc
10147,Vino malbec cafayate gran linaje bot 750 ml
10148,Vino cabernet sauvignon doña paula estate bot 750 cc
10149,Vino malbec doña paula bot 750 cc
10150,Cerveza quilmes 1890 bot 1 ltr
10151,Vino malbec f.sophenia bot 750 cc
10152,Vermouth lusera rosso bot 950 cc
10153,Vino chardon elab.roble saint felicien bot 750 cc
10154,Vino blanco benjamin dulce natural  bot 750 cc
10155,Vino bonarda norton bot 750 cc
10156,Licor strega naranja bot 700 cc
10157,Vino merlot finca flichman bot 750 cc
10158,Espumante blanco dada sweet dulce natural bot 750 ml
10159,Vino torrontes cosecha tardia tarde bot 500 cc
10160,Licor amarula bot 375 cc
10161,Vino cabernet sauvignon fuego negro bot 750 ml
10162,Vino cabernet sauvignon lujuria bot 750 cc
10163,Americano c/gas dr lemon con limòn bot 650 ml
10164,Licor bols menta bot 700 cc
10165,Champaña dulce emilia nieto senetiner bot 750 cc
10166,Fernet capri bot 450 cc
10167,Licor baileys bot 750 cc
10168,Vino blend alma negra bot 750 cmq
10169,Vino chardonnay san huberto bot 750 cc
10170,Vino tempranillo  alaris trapiche bot 750 cc
10171,Vino cabernet sauvignon atilio avena bot 750 ml
10172,Aperitivo amargo obrero bot 950 cc
10173,Vino cabernet sauvignon viniterra bot 750 cc
10174,Vino pinot noir reserva finca los maza bot 750 ml
10175,Whisky hiran walker bot 750 cc
10176,Vino cabernet sauvignon aristides bot 750 ml
10177,Vino chenin-chardonnay est. mendoza bot 750 c
10178,Vino cabernet-merlot alto uxmal bot 750 cc
10179,Whisky criadores estuche bot 1 ltr + petaca 195 cc
10180,Vino syrah tannat callia alta bot 750 cc
10181,Vino chardonnay omnium bot 750 cc
10182,Vino syrah rutini bot 750 cc
10183,Vino malbec hereford mejor ejemplar bot 750 cc
10184,Cervez patagonia amber lager bot 355 ml pak 6 uni
10185,Vino cabernet-malbec suter bot 750 cc
10186,Vino cabernet-malbec expresiones bot 750 cc
10187,Vino cabernet sauvignon callia magna terroir select bot 750 c
10188,Vino cosecha tardia latitud 33 bot 500 cc
10189,Vino chardonnay alto terrazas bot 750 cc
10190,Vino cabernet sauvignon finca beltran duo bot 750 cc
10191,Espumante tinto gamba d/pernice bot 750 cc
10192,Vino malbec-bonarda mora negra est c/decanter + 2 bot 750 cc
10193,Vino cabernet sauvignon fond de cave bot 500 cc
10194,Champaña brut nature nieto senet grand cuvee bot 750 cc
10195,Vino syrah elementos bot 750 cc
10196,Champaña brut f. de alvear bot 750 cc
10197,Champaña rose chandon bot 187 cc
10198,Vino chardonnay postales fdm bot 750 cc
10199,Vino blanco san felipe bot 750 cc
10200,Champaña extra brut mumm reserve bot 750 cc
10201,Vodka bolskaya bot 1 ltr
10202,Vino malbec clorindo testa saint felicien bot 750 cc
10203,Licor bols premium durazno bot 700 ml
10204,Champaña extra brut casa boher bot 750 cc
10205,Vino cabernet sauvignon f. sophenia bot 750 cc
10206,Vino cabernet sauvignon canciller bot 1500 cc
10207,Vino merlot alamos bot 750 cc
10208,Vino malbec don nicanor bot 750 cc
10209,Vino malbec malamado bot 187 cc
10210,Vino syrah norton joven bot 750 cc
10211,Cerveza miller lat 473 ml
10212,Vino cabernet sauvignon cabo de hornos bot 750 cc
10213,Champaña dulce colon sparkling bot 750 ml
10214,Vino ampakama viognier dulce natural bot 750 cc
10215,Vino malbec cornejo costas bot 750 cc
10216,Vino malbec coquena bot 750 cc
10217,Licor cusenier melon bot 700 cc
10218,Vino malbec enrique foster terruño bot 750 cc
10219,Habanos 5 cazadores j l piedra cja 5 uni
10220,Cerveza quilmes bajo cero porron bot 500 cc
10221,Vino merlot dada 2 mokka bot 750 cc
10222,Vino malbec-bonarda mora negra bot 750 cc
10223,Vino malbec domingo hnos bot 750 cc
10224,Vino malbec finca natalina bot 750 cc
10225,Vino blend malb/cb.sau/pet.ver killka bot 750 ml
10226,Vino tinto tocornal rosado bot 700 ml
10227,Vino torrontes ciclos bot 750 cc
10228,Cachaca velho barreiro bot 910 cc
10229,Cerveza quilmes night pack 6 bot 355 cmq
10230,Vino malbec diego murillo bot 750 cc
10231,Vino torront sauvignon b. sophenia ii bot 750 cmq
10232,Champaña dulce los arboles bot 750 ml
10233,Vino cabernet-malbec-merlot norton bot 375 cc
10234,Whisky j&b est bot 750 cc
10235,Vino torrontes humberto canale bot 750 cc
10236,Espumante blanco emilia extra brut bot 750 ml
10237,Vino chardonnay callia alta bot 750 cc
10238,Cerveza schofferhofer bot 500 cc
10239,Champaña extra brut norton estuche bot 750 cc
10240,Champaña rose baron b est bot 750 cc
10241,Vino cabernet sauvignon luna bot 750 cc
10242,Vino chardonnay terrazas bot 750 cc
10243,Vino cabernet sauvignon san huberto roble bot 750 cc
10244,Vino blend cruz alta bot 750 cc
10245,Champaña brut nature rutini bot 750 cc
10246,Vino chardon varietal - per nolita bot 750 ml
10247,Vino blend gran caballero de la cepa bot 750 ml
10248,Vino tinto tocornal bot 700 ml
10249,Vino blend malbec-tannat felix bot 750 cc
10250,Cerveza iguana no retornable bot 970 cc
10251,Vino cabernet-malbec latitud 33º 2 uni bot 750 ml
10252,Vino malbec suter reserva bot 750 cc
10253,Vino syrah fond de cave reserva bot 750 cc
10254,Vino chardonnay d.v catena bot 750 cc
10255,Vino malbec graffigna centenario bot 750 cc
10256,Licor bols premium chocolate bot 700 ml
10257,Vino blend jubilo tikal bot 750 cmq
10258,Vino cabernet sauvignon finca la niña bot 750 cc
10259,Vino pinot noir salent. primus bot 750 cc
10260,Vino syrah finca flichman bot 750 cc
10261,Vino malbec rosado uxmal bot 750 ml
10262,Vino malbec imago trapiche bot 750 ml
10263,Vino malbec tapiz bot 750 cc
10264,Vino malbec fabre montmayu bot 750 cc
10265,Vino chardonnay pulenta estate bot 750 cc
10266,Champaña demi sec fiancee bot 750 cc
10267,Vino cabernet merlot tapiz reserva bot 750 cc
10268,Vino malbec san huberto bot 1.5 ltr
10269,Champaña brut tocornal bot 750 cc
10270,Vino chenin-ugni hereford bot 750 cc
10271,Licor cusenier frutilla bot 700 cc
10272,Vino malbec finca la escondida cja 3 ltr
10273,Vino syrah santa julia reserva bot 750 cc
10274,Vino syrah/merlot finca los quiroga bot 1125 cmq
10275,Vino chablis cornejo costas bot 1.125 ltr
10276,Cerveza miller pack lat 4 u 473 ml + set 2 parlantes
10277,Vino blanco cuvee bot 700 cc
10278,Vino tinto seleccion suc. abel michel torino bot 1125 ltr
10279,Grappa valleviejo bot 950 cc
10280,Vino pinot noir trumpeter reserve bot 750 cc
10281,Vino chardonnay fond de cave bot 750 cc
10282,Vino cabernet sauvignon el esteco bot 750 ml
10283,Vino blanco santa ana sel.especial bot 750 cc
10284,Ron flor de caña añejo ojo 4 años bot 750 ml
10285,Vino malbec zorzal bot 750 cc
10286,Cognac otard dupuy añejo bot 750 cc
10287,Whisky jameson bot 750 cc
10288,Vino malbec marcus bot 750 cc
10289,Vino blanco termidor dulce ttb 1 ltr
10290,Vino cabernet sauvignon san huberto bot 750 cc
10291,Vino tinto andeluna pasionado bot 750 cc
10292,Vino cabernet sauvignon norton bot 750 cc
10293,Vino malbec-syrah san telmo bot 750 cc
10294,Vino blanco viñas de alvear bot 700 cc
10295,Cachaza macao bot 750 cc
10296,Champaña extra brut norton bot 750 cc
10297,Vino malbec don valentin roble bot 750 cc
10298,Vino malbec rosado san felipe bot 750 cc
10299,Vino blanco norton bot 750 cc
10300,Champaña brut veuve clicquot bot 750 cc
10301,Vino malbec robino bot 750 cc
10302,Licor tia maria cream bot 690 cc
10303,Vino cabernet sauvignon feder.de alvear bot 750 cc
10304,Champaña dulce gancia italian dolce bot 750 cc
10305,Vino malbec ventus bot 750 ml
10306,Vino cabernet sauvignon el portillo bot 750 cc
10307,Vino cabernet sauvignon santa julia bot 750 cc
10308,Champaña brut fiancee bot 750 cc
10309,Vino chardonnay cruz alta bot 750 cc
10310,Vino chardonnay canciller bot 750 cc
10311,Vino tinto toro bot 930 cc
10312,Vino malbec-merlot norton bot 750 cc
10313,Combo aperitivo gancia + aperitivo red bitter pak 2 uni
10314,Vino tinto resero ttb 1 ltr
10315,Vino cabernet sauvignon bianchi particular bot 750 cc
10316,Champaña la grande dame brut estuche 1 uni est 750 cc
10317,Vino malbec fond de cave bot 500 cc
10318,Vino cabernet sauvignon quara reserva bot 750 cc
10319,Vino chardonnay-sauvignon ventus bot 750 cc
10320,Fernet vittone bot 750 cc
10321,Espumante tinto frizze violet evolution bot 750 cc
10322,Vino cabernet sauvignon los pasos bot 750 ml
10323,Vino malbec finca flichman bot 750 cc
10324,Vino cabernet sauvignon novecento reserva bot 750  cc
10325,Clerico fizz la farruca bot 720 cc
10326,Vino malbec terrazas single vineyard bot 750 cc
10327,Vino malbec elementos bot 750 cc
10328,Champaña dulce pascual toso bot 750 ml
10329,Vino malbec dada bot 750 ml
10330,Whisky old smuggler bot 500 cc
10331,Vino malbec-syrah finca natalina bot 750 cc
10332,Vino torrontes san telmo esencia bot 750 cc
10333,Vino syrah terrazas bot 750 cc
10334,Vino cabernet sauvignon esmeralda fernandez bot 750 cc
10335,Vino malbec animal bot 750 cc
10336,Vino chablis valderrobles bot 750 cc
10337,Cerveza negra quilmes bock bot 1 lt
10338,Vino cabernet sauvignon fabre montmayu bot 750 cc
10339,Champaña extra brut nieto senetiner bot 750 cc
10340,Vino malbec omnium bot 750 cc
10341,Piña colada clinton bot 1 ltr
10342,Espumante blanco omnium dolcissimo bot 750 ml
10343,Vodka hiram walker bot 1 ltr
10344,Champaña extra brut leo bot 750 cc
10345,Grappa candolini bot 1 ltr
10346,Vino torrontes territorio bot 750 cc
10347,Vino cabernet-merlot atilio avena bot 750 cc
10348,Vino blanco graffigna pinot grigio bot 750 cc
10349,Vino f.tinto . martinet bru bot 750 cc
10350,Vino malbec + merlot marcus est 2 uni bot 750 cc
10351,Espumante blanco prosecco martini bot 750 cc
10352,Vino torrontes michel torino bot 750 cc
10353,Vino malbec los cardos doña paula bot 750 cc
10354,Vino tannat elementos bot 750 cc
10355,Champaña extra brut suter bot 750 ml
10356,Vino cabernet bouchet f. los nobles bot 750 cc
10357,Sidra apple storm bot 1 lt
10358,Vino cabernet sauvignon la consulta bot 750 cc
10359,Vino malbec saurus clasico bot 750 cc
10360,Champaña brut nature animal bot 750 cc
10361,Vino syrah familia gascon bot 750 cc
10362,Vino cabernet-franc f.d.cave reserva bot 750 cc
10363,Vodka bols triple destilado bot 750 cc
10364,Vino dulce natural los pasos bot 750 ml
10365,Vino syrah terrazas reserva bot 750 cc
10366,Vodka mango peters bot 950 cc
10367,Vino malbec malma bot 750 cc
10368,Vino malbec quara oak bot 750 cc
10369,Vino tinto quorum bot 750 cc
10370,Vino cabernet sauvignon territorio bot 750 cc
10371,Vino syrah gestos bot 750 cc
10372,Vino cabernet sauvignon finca flichman bot 750 cc
10373,Vino malbec estiba i bot 750 c
10374,Vino cabernet sauvignon trivento conch/tor bot 750 cc
10375,Vino chablis federico de alvear bot 1.25 ltr
10376,Champaña brut nature nieto  senetiner bot 1.5 ltr
10377,Vino tinto zumuva ttb 1 ltr
10378,Vino malbec novecento bot 750 cc
10379,Cerveza isenbeck bot 1 lt
10380,Champaña chandon cuvee reserve pinot noir bot 750 cc
10381,Vino cabernet sauvignon rumbos bot 750 cc
10382,Champaña extra brut callia bot 750 cc
10383,Vino blanco norton bot 375 cc
10384,Vino torrontes nieto senetiner bot 750 cc
10385,Vino cabernet sauvignon finca las moras bot 750 cc
10386,Ron bacardi grand melon bot 750 cc
10387,Cerveza patagonia bohemian pilsener bot 355 cmq
10388,Vino cabernet sauvignon terra roble bot 750 cc
10389,Champaña brut rosell boher estuche bot 750 cc
10390,Champaña demi sec tocornal bot 750 cc
10391,Champaña rose mumm brut bot 750 cc
10392,Vino tinto phebus bot 750 cc
10393,Vino borgoña santa ana bot 1.2 ltr
10394,Vino cabernet sauvignon cristobal bot 750 cc
10395,Vino cabernet-malbec yauquen bot 750 cc
10396,Vino cabernet sauvignon viento sur bot 750 cc
10397,Vino malbec don nicanor barrel select 750 cc
10398,Vino malbec rosado foster pink bot 750 cmq
10399,Cerveza imperial bot 330 cc
10400,Vino cabernet sauvignon callia alta bot 750 cc
10401,Champaña blanc de blancs alma negra bot 750 cc
10402,Americano el abuelo bot 950 cc
10403,Vino chardonnay tracia bot 750 cc
10404,Champaña extra brut omnium bot 750 cc
10405,Cerveza schneider lat 355 cc
10406,Vino sauvignon blanc luigi bosca bot 750 cc
10407,Licor bols premium sour apple bot 700 ml
10408,Vino cabernet sauvignon fond de cave gran reserva bot 750cc
10409,Vino blanco callia amable dulce natural bot 750 cc
10410,Vino malbec escorih gascon bot 750 cc
10411,Vino cabernet sauvignon genesis bot 750 cc
10412,Champaña extra brut estancia mendoza bot 750 cc
10413,Champaña extra brut gran cuvee nieto senetiner bot 750 cc
10414,Vino lavaque bot 700 cc
10415,Espumante tinto dulce natural new age bot 750 ml
10416,Vino malbec gran rodas bot 750 cc
10417,Vino malbec fin del mundo bot 750 cc
10418,Vino malbec hereford bot 750 cc
10419,Vino syrah trapiche origen bot 750 cc
10420,Vino cabernet sauvignon f.la escondida bot 750 cc
10421,Vino bonarda sangre de viña bot 750 cc
10422,Vino tinto abocado michel torino bot 750 cc
10423,Cerveza isenbeck no retornable bot 1 lt
10424,Sidra la farruca etiqueta blanca bot 710 cc
10425,Vino chardonnay-semillon castel chandon bot 750 cc
10426,Vino tinto santa isabel bot 750 cc
10427,Champaña rose feder.de alvear dulce bot 750 cc
10428,Vino tinto rumbos sta ana bot 750 cc
10429,Vino cabernet sauvignon los arboles bot 750 cc
10430,Whisky blenders bot 1 ltr
10431,Sidra apple storm bot 340 cc
10432,Vino cabernet sauvignon saint felicien bot 750 cc
10433,Espumante blanco maria codorniu reserve bot 750 cc
10434,Vino chablis clasico abeerdeen angus bot 700 ml
10435,Cerveza imperial scotch ale bot 1 lt
10436,Vino cabernet sauvignon cornejo costas bot 750 cc
10437,Vino cabernet sauvignon lagrima bot 750 ml
10438,Vino ugni blanco finca natalina bot 750 cc
10439,Vino bourgogne meo-camuzet bot 750 cc
10440,Apet mojito mixx tail quilmes lat 269 ml
10441,Vino tinto traful bot 750 cc
10442,Licor cusenier cognac bot 700 cc
10443,Champaña dom perignon rose estuche 1 uni bot 750 cc
10444,Cerveza lata x 354 quilmes lat 1 uni
10445,Ron bacardi añejo bot 750 cc
10446,Licor peters fresas bot 700 cmq
10447,Champaña pommery brut royal bot 750 cmq est 2 uni
10448,Vino cabernet sauvignon lagarde bot 750 cc
10449,Vino torrontes viejo solar dulce natural bot 1.25 ltr
10450,Vino cabernet sauvignon estrella de los andes bot 750m
10451,Ron flor de caña añejo blanco extra seco bot 750 ml
10452,Vino syrah cafayate bot 750 ml
10453,Espumante blanco new age extra brut bot 750 ml
10454,Vino chardonnay los arboles bot 750 cc
10455,Champaña extra brut chandon bot 6 ltr
10456,Espumante blanco frizze anana new touch bot 750 cc
10457,Vermouth punt e mes carpano bot 750 cc
10458,Vino tinto rincon famoso bot 750 cc
10459,Vino malbec norton joven bot 750 cc
10460,Cerveza heineken por 330 cc
10461,Vino syrah cafayate reserva bot 750 ml
10462,Vino cabernet sauvignon misterio bot 750 cc
10463,Vino malbec finca el portillo estuche bot 750 cc
10464,Vino tinto termidor tradicion ttb 1 ltr
10465,Vino tinto yacochuya 2009 bot 750 cc
10466,Champaña brut nature nieto senetiner bot 187 cc
10467,Grapa rutini bot 500 cc
10468,Vino malbec animal estuche 1 bot 750 cc
10469,Whisky royal salute 21 años est bot 700 cc
10470,Vino tinto fin del mundo special blend lata bot 750 cc
10471,Cerveza negra quilmes stout bot 970 cc
10472,Vino malbec putruele bot 750 cc
10473,Vino malbec viniterra bot 750 cc
10474,Vino malbec terrazas alto bot 750 cc
10475,Vino cosecha tardia santa julia bot 500 cc
10476,Champaña dulce feder.de alvear bot 750 cc
10477,Vino malbec escorihuela gascon c/est bot 750 cc
10478,Champaña brut baron b bot 750 cc
10479,Vino cabernet sauvignon domingo molina bot 750 cc
10480,Cerveza quilmes night bot 355 cc
10481,Vino blend cab. sauv/-cab. fra nieto senetiner bot 750 ml
10482,Champaña dulce delice chandon bot 750 cc
10483,Vino malbec-petit verdot nieto senetiner  bot 750 cc
