id,nombre
4896,Salsa de tomate gourmet mexico künhe  bot 250 ml
4897,Te twinings voyage african anana/hibiscus est 25 saq
4898,Mermelada chantaine frambuesas rojas fra 325 grm
4899,Dulce light frutos bosque masseube fra 260 grm
4900,Fideos largos sem. la molisana fetuccia paq 500 grm
4901,Salsa picante tabasco fra 60 cc
4902,Salsa tau delta barbacoa pet 430 grm
4903,Aji picante dr.alimentaria en trozos fra 20 grm
4904,Mermelada light cuartocrecient frutilla con stevi fra 300 gr
4905,Fideos orecchiette pugliese la molisana  bsa 500 grm
4906,Mermelada chantaine cerezas negras fra 325 grm
4907,Fideos largos sem. de cecco linguine paq 500 grm
4908,Te twinings earl grey est 25 saq
4909,Molinillo indo pimienta negra fra 50 grm
4910,Dulce de mosquetas masseube fra 450 grm
4911,Molinillo indo capuchino fra 40 grm
4912,Mostaza künhe dulce fra 250 ml
4913,Arroz dragoni para paella bomba cja 1 kg
4914,Recarga finas hierbas indo fra 30 grm
4915,Mermelada light cuartocrecient higo con estevia fra 300 grm
4916,Albahaca 1854 fra 22 grm
4917,Fideos largos sem. barilla spaghettini nro 3 cja 500 grm
4918,Sopa instantanea nissin carne con verdura tar 63 grm
4919,Alimento para bebe nutribaby manzana y banana pak 113 grm
4920,Alimento p/bebe frutapura manzana/pera pak 400 grm
4921,Cereal infantil nutrilon maiz lat 200 grm
4922,Cereal infantil espinaca vegetales nestum 200 grm
4923,Cereal infantil trigo y  miel nestum cja 200 grm
4924,Cereal infantil nutrilon arroz lat 200 grm
4925,Cereal infantil nestum bebible trigo bsa 400 grm
4926,Alimento para bebe nutribaby vegetal con pollo pak 113 grm
4927,Cereales infantile arroz avena ba nutrilon lat 200 grm
4928,Galletitas p/bebe smookies ciruela y banana paq. 150 grm
4929,Alimento para bebe organico nutribaby pera pack 226 grm
4930,Cereal infantil trigo y leche nestum cja 350 grm
4931,Cereal infantil bebible trigo nestum bsa 400 grm
4932,Alimento para bebe organico manzana nutribaby pack 226 grm
4933,Cereal infantil nestum multicereal c/hierro bsa 500 g
4934,Alimento p/bebe frutapura multifruta pak 400 grm
4935,Galletitas p/bebe smookies pera y trigo paq 150 grm
4936,Alimento para bebe organico nutribaby mix de frut pak 226g
4937,Cereal infantil maiz c/hierro nestum cja 200 grm
4938,Galletitas para bebe smookies manzana y trigo paq 150 grm
4939,Cereal infantil arroz c/hierro nestum cja 200 grm
4940,Cereal infantil nutrilon arroz banana y manzana lat 200 grm
4941,Cereal infantil zapallo con zanahoria vegetales  nestum
4942,Alimento para bebe nutribaby pera pak 113 grm
4943,Alimento para bebe organico nutribaby manz/ban  pak 226grm
4944,Alimento para bebe nutribaby pack frutal pak 452 grm
4945,Alimento para bebe nutribaby vegetal con arroz  pak 113 grm
4946,Alimento p/bebe frutapura manzana/banana pak 400 grm
4947,Cereal infantil nutrilon 5 cereales  lat 200 grm
4948,Cereal infantil nestum multicereal c/hierro cja 200 g
4949,Galletitas p/bebe smookies ciruela y trigo paq 150 grm
4950,Cereal infantil trigo y frutas nestum cja 200 grm
4951,Alimento para bebe nutribaby manzana y pera pak 113 grm
4952,Alimento para bebe nutribaby vegetal con pollo pak 113 grm
4953,Alimento para bebe organico nutribaby manza/pera pak 226 g
4954,Alimento para bebe nutribaby vegetal con pasta pak 113 grm
4955,Alimento para bebe nutribaby manzana pak 113 grm
4956,Alimento para bebe nutribaby mix de frutas pak 113 grm
4957,Alimento para bebe nutribaby vegetal con carne pak 113 grm
4958,Alimento p/bebe frutapura manzana pak 400 grm
4959,Yerba mate organica mision natural paq 500 grm
4960,Harina de soja organica esq.de l.flores paq 500 grm
4961,Te negro organico mision  natural en hebras est 100 grm
4962,Arroz esq.de l.flores yamani paq 1 kgm
4963,Yerba mate org. suave laesquinafl paq 500 grm
4964,Harina de maiz organica esq.de l.flores  paq 500 grm
4965,Harina integral organica esq.de l.flores fina paq 1 kg
4966,Arroz integral esq.de l.flores paq 1 kgm
4967,Azucar organica schatzi paq 500 grm
4968,Yerba mate organica esq.de  l.flores tradic. paq 500 grm
4969,Te verde organico mision natural hebras est 100 grm
4970,Avellana/nuez/almendra empaque mixto finca blanca paq 400 gr
4971,Nuez con cascara blancanuez paq 250 grm
4972,Nuez postrefino peladas en mitades paq 70 grm
4973,Higo aldeva con nuez blanco y negro bli 400 grm
4974,Nuez blancanuez sin cascara paq 200 grm
4975,Pasas de uva pasablanca paq 200 grm
4976,Higo aldeva con nuez en ristra paq 200 grm
4977,Mani postrefino pelado salado tostado paq 125 grm
4978,Nuez blancanuez sin cascara bol 100 grm
4979,Pasas de uva la parmesana sin semilla bol 250 grm
4980,Mani almendras y castañas postrefino tost y sal paq 100g
4981,Almendras postrefino peladas paq 100 grm
4982,Higo aldeva blanco elegido bli 250 grm
4983,Almendra postrefino peladas tostadas saladas paq 100 grm
4984,Pasas de uva postrefino sin semillas paq 125 grm
4985,Mix frutas secas fincablanca mani-pasas-almendr pou 100 grm
4986,Grasa porcina reciento sch 500 grm
4987,Dulce de leche vacalin fra 450 grm
4988,Postre danette chocolate pak 2 uni 190 grm
4989,Yogu descremado cremoso sancor yogs light frutilla pak 240 g
4990,Queso untable tregar salame pot 200 grm
4991,Dulce de leche vacalin pot 400 grm
4992,Yogur cremoso entero sancor primeros sabo manz/ban 240 grm
4993,Jugo naranja durazno citric ttb 1 lt
4994,Dulce de leche sancor clasico pot 400 grm
4995,Manteca coto pan 200 grm
4996,Yogur cremoso entero sancor primeros sabores vaini 240 grm
4997,Postre danette chocolate c/ confite de chocola pot 120 grm
4998,Yogur batido entero yogurisimo cremix c/chisp cho cofler 170
4999,Queso untable tholem tentaciones 4 quesos pot 190 g
5000,Yogur bebible entero tregar frutilla sch 1 kg
5001,Yogur batido descremado dahi c/ frutilla fra 200 grm
5002,Yogur descremado ser c/colchon frutill/aran/grana pot 180 grm
5003,Leche entera la serenisima lv calcio vit a/c/d/b9 cnt 1 ltr
5004,Leche entera coto lv vit.a/d ttb 1 ltr
5005,Dulce de leche tregar pot 400 grm
5006,Yogur entero sancor yogs firme multivi vainilla pak 2u 250 gr
5007,Yogur batido entero yogurisimo cremix c/conf cho rocklet 170
5008,Margarina danica dorada vitamina a/d/e pot 250 grm
5009,Flan sancor light  pak 2 uni 240 grm
5010,Postre shimy vainilla/ dulce de leche pot 120 grm
5011,Queso untable philadelphia  crem/orig. pan 227 grm
5012,Alim. base leche la serenisima lv vainilla flakes bot 1 ltr
5013,Levadura mi pan instantanea sob 10 grm
5014,Yogur entero sancor yogs multiv durazno pot 180 grm
5015,Queso untable la paulina magro pot 190 grm
5016,Levadura levex instantanea  4 uni est 40 grm
5017,Yogur bebible entero sancor yogs vainilla bot 185 grm
5018,Jugo naranja citric ttb 1.5 ltr
5019,Leche infantil nutrilon profutura 1 ttb 200 ml
5020,Leche descremada tregar l.v.  sch 1 lt
5021,Leche descremada sancor l.v. c/hierr/vit c multinutr ctn 1l
5022,Manteca la paulina pan 200 grm
5023,Yog.desc.frut mult frutilla/duraz sancor yogs pot 180 grm
5024,Alimento lacteo danonino vainilla danoformi bot 185 grm
5025,Yogur entero dahi frutilla fra 200 grm
5026,Yogur descremado sancor yogs light vainilla 190 grm
5027,Queso untable light neufchatel pot 190 grm
5028,Yogur entero sancor yogs multivitam natural pot 190 grm
5029,Dulce de leche de campo sancor pot 400 grm
5030,Queso crema coto entero clasico pot 300 grm
5031,Queso untable milkaut cheddar pot 190 grm
5032,Yogur batido descremado ser calcio vainilla vit 2  240 grm
5033,Queso untable tholem salmon rosado pot 190 grm
5034,Yogur batido entero yogurisimo cremix vainilla pak 480 grm
5035,Dulce de leche repostero tregar pot 400 grm
5036,Jugo naranja citric bid 3 ltr
5037,Crema de leche la serenisima f/ vitaminas a/e ctn 200 cmq
5038,Alim. base leche la serenisima lv vainilla flakes ttb 250 cc
5039,Queso untable philadelphia light salmon pot 226 grm
5040,Dulce de leche san ignacio fra 840 grm
5041,Queso crema mendicrim 0% tu toque pot 300 grm
5042,Postre fruti danette pot 95 grm
5043,Alim. base leche descremada seremix melon sch 1 lt
5044,Margarina danica soft light vitam a/d pot 200 grm
5045,Queso untable la paulina port salut pot 190 grm
5046,Yogur descremado sancor yogs multiv. durazno pot 180 grm
5047,Yogur bebible descremad sancor multiv ftos bosque sch 900 grm
5048,Yogur bebible entero yogurisim banana con ddl sch 1 kgm
5049,Leche entera sancor u/past extra calcio sch 1 ltr
5050,Yogur entero tregar c/durazno pot 160 grm
5051,Yogur entero sancor yogs multiv framb/mora pot 180 grm
5052,Queso untable la paulina fontina pot 190 grm
5053,Leche coco mais coco bot 500 cmq
5054,Yogur bebible descremado ser libre multifruta bot 185 grm
5055,Yogur bebible descremado sancor yogs frutilla bot 185 g
5056,Ricotta granja arrivata con crema fwp 300 grm
5057,Leche entera tregar lv sch 1 ltr
5058,Leche entera tres niñas l.vida tradicion c. cnt 1 ltr
5059,Yogur bebible entero yogurisimo vainilla sch 1300 g
5060,Alim. infantil a base leche de junior frutilla ttb 200 cc
5061,Yogur bebible descremado ser calcio durazno vit bot 185 grm
5062,Leche entera coto ultrapasteurizada sch 1 ltr
5063,Leche entera la serenisima e/calcio vit a/c/d/b9 sqa 1 lt
5064,Yogur entero activia ciruela pak 4 uni 500 grm
5065,Margarina delicia pan 200 grm
5066,Yogur descremado dahi frutilla fra 200 grm
5067,Manteca ciudad del lago pan 200 grm
5068,Yogur entero activia frutilla pot 250 grm
5069,Queso untable light finlandia gruyere vit a/d pot 200 grm
5070,Leche descremada sancor lv nutriequil mult ttb 1 ltr
5071,Yogur bebible descremado sancor fruto bosque bot 500 gr
5072,Queso untable finlandia vitamina a/d pot 300 grm
5073,Yogur batido entero yogurisimo cremix banana sch 960 grm
5074,Queso untable tregar neufchatel azul pot 190 grm
5075,Postre serenito vainilla crash pot 200 grm
5076,Yogur bebible entero sancor yogs durazno bot 500 grm
5077,Crema de leche la serenisima vitamina a/e ctn 500 cc
5078,Yogur batido descremado ser calcio durazno vit 2 u 240 grm
5079,Manteca la serenisima extra vitamina a-e pan 100 grm
5080,Leche descremada la serenisima lv vitam a/c/d/b9 bot 1 ltr
5081,Leche descremada tres niñas l.v tradicion calidad ctn 1 lt
5082,Yogur bebible descremado ser frutilla sch 1000 grm
5083,Manteca sancor multivitamina pan 200 grm
5084,Yogur bebible descremado dahi banana bot x 200 grm
5085,Postre shimy vainilla con rocklets pot 120 grm
5086,Leche entera la lacteo con calcio ttb 1 ltr
5087,Alim. base leche la serenisima lv cafe latte bot 1 ltr
5088,Postre serenito vainilla/ dulce de leche pot 125 grm
5089,Yogur descremado firme coto vainilla pak 2 uni 125 grm
5090,Queso untable light finlandia al pesto pot 200 grm
5091,Yogur bebible entero coto durazno sch 1 kg
5092,Yogur batido entero yogurisimo cremix c/gall ycho cindor 165
5093,Leche descremada la serenisima e/ calcio vit a/c/d b9 sch 1lt
5094,Queso crema mendicrim light tu toque pot 300 grm
5095,Queso crema light . san ignacio pot 500 grm
5096,Leche descremada la serenisima c/vitaminas a y d sch 1lt
5097,Yogu descremado cremoso sancor yogs light cir/mzna pak 240 g
5098,Manteca sancor untable pot 200 grm
5099,Queso crema casancrem regular pot 300 grm
5100,Yogur descremado sancor yogs multiv.framb/mora pot 180 grm
5101,Yogur bebible entero sancor yogs frutilla bot 185 grm
5102,Yogur descremado sancor yogs light frutilla pot 190grm
5103,Leche infantil enfabebe premium 1 ttb 200 ml
5104,Leche infantil nutrilon profutura 4 ttb 200 ml
5105,Alim. base leche la serenisima lv cappuccino light bot 1 ltr
5106,Leche chocolatada 7 dias ttb 1 ltr
5107,Postre danette chocolate pak 380 grm
5108,Dulce de leche la serenisima e/colonial c/calcio pot 400 gr
5109,Postre serenito chocolate crash pot 200 grm
5110,Leche fermentada actimel multifruta vita pack 6 u 600 g
5111,Leche descremada la serenisima ultra dha sch 1 ltr
5112,Dulce leche tradicional lapataia fra 850 grm
5113,Yogur bebible entero sancor yogs mango/durazn bot 1000 grm
5114,Yogur bebible descremado sancor yogs vainilla bot 1000g
5115,Yogur descremado sancor yogs c/ avena y miel pot 170 grm
5116,Postre sublime dulce leche pot 110 grm
5117,Leche descrem up nutrieq.mul sancor sch 1 ltr
5118,Arroz con leche tregar light pot 180 grm
5119,Yogur entero sancor yogs multiv frutilla pot 180 grm
5120,Postre serenito chocobomba pot 118 grm
5121,Yogur bebible entero milkaut multifruta fortificado sch 1 k
5122,Yogur entero tregar con arandanos pot 160 grm
5123,Yogur bebible descremado sancor frut/kiwi bot 500 grm
5124,Leche fermentada sancor bio frutilla bot 185 grm
5125,Flan sancor de leche con dulce de leche pak 2 uni 240 grm
5126,Queso untable la serenisima vit a/d cremon pot 200 grm
5127,Leche infantil nutrilon profutura 3 ttb 200 ml
5128,Dulce de leche la lacteo tradicional pot 400 grm
5129,Leche descremada la serenisima lv calcio vita/c/d/b9 cnt 1 lt
5130,Queso crema san ignacio pot 320 grm
5131,Yogur bebible entero sancor yogs durazno bot 185 grm
5132,Queso untable sancor por salut tradicional pot 190 grm
5133,Leche descremada la serenisima fibractiva sqa 1 lt
5134,Queso untable finlandia vitamina a/d pot 200 grm
5135,Queso untable light finlandia cheddar vit a/d pot 200 grm
5136,Dulce de leche sin azúcar san ignacio fra 450 grm
5137,Yogur descremado ser joyful frutos rojos pot 125 grm
5138,Leche chocolatada sancor uat pak 4 uni 1000 cc
5139,Leche fermentada sancor bio frutilla bot 185 grm
5140,Yogur entero firme sancor yogs multiv frutilla pack x2 250 gr
5141,Queso untable tregar neufchatel clasico pot 190 grm
5142,Yog.bat.ent. frutilla yogurisimo pot 85 grm
5143,Crema de leche veronica pot 200 cmq
5144,Margarina manty pan 200 grm
5145,Yogur desc cremoso sancor yogs light fram/fru/mora pak 240 g
5146,Jugo naranja citric ttb 1 ltr
5147,Jalea shimy frutilla pot 110 grm
5148,Manteca la serenisima vitamina a/ e paq 500 grm
5149,Yogur descremado sancor yogs multiv. c/cereales pot 170 grm
5150,Dulce de leche la serenisima fuente de calcio pot 250 grm
5151,Leche descremada la serenisima e/calcio vit a/c/d/b9  1 ltr
5152,Leche entera calcio/vit/b9 sancor sch 1 ltr
5153,Manteca la serenisima untable light vitamina a/e pot 200 grm
5154,Alim. base leche descremada seremix bana-vainill sch 1 lt
5155,Yogur descremado ser c/colchon durazno y manzana pot 180 grm
5156,Dulce de leche poncho negro fra 450 grm
5157,Queso untable veronica queso azul pot 190 grm
5158,Yogur cremoso entero sancor yogs durazno pak 240 grm
5159,Yogur bebible entero sancor yogs frutilla bot 500 grm
5160,Arroz con leche tregar clasico pot 180 grm
5161,Yogur batido descremado ser calcio frutilla vit 2 u 240grm
5162,Queso untable tholem crema y cebolla pot 190 grm
5163,Leche descremada la serenisima serecol sqa 1 ltr
5164,Yogur bebible entero yogurisimo frutilla bot 185 gr
5165,Postre ser chocolate pak 200 grm
5166,Leche entera la serenisima lv vit a/c/d/b9 bot 1 ltr
5167,Margarina danica clasica + leche pan 500 grm
5168,Queso untable philadelphia cebolla pot 226 grm
5169,Yogur bebible entero sancor multiv. vainilla sch 1000 grm
5170,Crema de leche la serenisima vitamina a y e pot 200 cc
5171,Manteca sancor multivitamina pan 100 grm
5172,Yogur bebible descremado dahi vainilla bot x 200 grm
5173,Leche descremada la lacteo con calcio ttb 1 ltr
5174,Postre shimy dulce de leche pot 120 grm
5175,Queso untable light finlandia salame pot 200 grm
5176,Queso untable light veronica pot 190 grm
5177,Yogur bebible entero coto vainilla sch 1 ltr
5178,Yogur descremado ser c/cereal frutos del bosque pot 173 grm
5179,Queso crema mendicrim cremoso tu toque pot 460 grm
5180,Yogur bebible entero tregar vainilla sch 1 kg
5181,Crema de leche sancor multivitaminas pot 200 cc
5182,Leche descremada la serenisima deslact. ttb 500 cc
5183,Yogur descremado firme sancor yogs durazno pot 180 grm
5184,Alim. infantil base leche junior mandarina ttb 200 cmq
5185,Postre danette dulce de leche pak 2 uni 190 grm
5186,Yog descremado cremoso sancor yogs light durazno pak 240 gr
5187,Margarina margadan pan 200 grm
5188,Yogur bebible entero yogurisimo vainilla ttb 1000gr
5189,Yogur batido entero dahi c/ frutilla fra 200 grm
5190,Queso crema coto light pot 300 grm
5191,Alim. base leche la serenisima lv sabor cafe latte ttb 250 c
5192,Leche chocolatada sancor shake ttb 250 cc
5193,Leche infantil enfabebe premium 2 ttb 200 ml
5194,Queso crema mendicrim light tu toque pot 460 grm
5195,Queso untable la paulina 4 quesos pot 190 grm
5196,Leche infantil crecer 2 plus ttb 200 ml
5197,Yogur bebible entero milkaut frutilla fortificado sch 1 kgm
5198,Yogur bebible descremado ser calcio frutilla bot 185 grm
5199,Queso untable veronica ciboulette pot 190 grm
5200,Flan sancorito con caramelo pot 110 grm
5201,Dulce de leche coto fra 450 grm
5202,Yogur bebible descremado sancor yogs mang/dura bot 185g
5203,Queso blanco tregar light pot 300 grm
5204,Yogur bebible descremad sancor yogs light per/manz bot 1000 g
5205,Dulce leche tradicional lapataia fra 450 grm
5206,Queso untable la serenisima vit a/d port salut pot 200 grm
5207,Dulce de leche repostero coto pot 500 grm
5208,Queso untable light finlandia vitamina a/d pot 200 grm
5209,Queso untable tholem tentacion salame pot 190 grm
5210,Yogur bebible entero sancor yogs frutilla bot 1000 grm
5211,Leche infantil sancor bebe 3 nutricion completa ttb 200 ml
5212,Dulce de leche light san ignacio pot 400 grm
5213,Leche infantil la serenisima crecer plus 1/3 años brk 1 ltr
5214,Yogur bebible descremado sancor yogs frutilla sch 900 g
5215,Yogur cremoso entero sancor yogs dulc de leche pak 240 grm
5216,Yogur batido descremado dahi c/ frutos bosque fra 200 grm
5217,Margarina manterina danica pan 200 grm
5218,Yogur entero sancor yogs multinutr. vainilla pot 190 gr
5219,Yogur entero yogurisimo c/cer colch frut energia total 161 g
5220,Yogur bebible entero sancor yogs multiv.dzno sch 1000 grm
5221,Postre de maní georgalos nucrem paq 320 grm
5222,Yogur descremado tregar c/frutas frutilla pot 160 grm
5223,Yogur bebible entero sancor yogs multivit. banana sch 1 kg
5224,Yogur bebible descremado ser frutilla ttb 1000 grm
5225,Margarina danica fitacol pot 250 grm
5226,Postre shimy vainilla con chocolate mix pot 118 grm
5227,Yogur bebible entero milkaut vainilla fortificado sch 1 kg
5228,Manteca multivitamina sancor pan 500 grm
5229,Queso crema mendicrim original tu toque pot 300 grm
5230,Yog.bat.ent. vainilla yogurisimo pot 85 grm
5231,Queso crema tregar pot 200 grm
5232,Dulce de leche sancor fra 454 grm
5233,Yogur descremado tregar c/ frutas durazno pot 160 grm
5234,Manteca veronica pan 100 grm
5235,Alim. base leche la serenisima lv cappuccino light ttb 250 c
5236,Queso untable light finlandia vitamina a/d pot 300 grm
5237,Dulce de leche coto pot 400 grm
5238,Yogur descremado sancor yogs c/cereales pot 162 grm
5239,Queso untable light la serenisima por salut pot 200 g
5240,Leche descremada ciudad del lago ultra pasteur. sch 1 ltr
5241,Flan light sancor con ddl pak 2 uni 240 grm
5242,Yogur entero sancor yogs c/cereales pot 165 grm
5243,Yogur batido entero yogurisimo cremix durazno sch 960 grm
5244,Flan sancor con caramelo  pak 2 uni 240 grm
5245,Alim. infantil base leche junior manzana ttb 200 cc
5246,Manteca veronica pan 200 grm
5247,Yogur batido entero yogurisimo cremix limon pak 240 grm
5248,Yogu descremado cremoso sancor yogs light vainilla pak 240 g
5249,Leche infantil nutrilon profutura 2 ttb 200 ml
5250,Dulce leche . casanto pot 400 grm
5251,Crema de leche sancor light pot 200 cc
5252,Leche entera veronica l.v elevado cla ttb 1 ltr
5253,Yogur bebible descremado tregar frutilla sch 900 grm
5254,Leche descremada coto ultra pasteurizada sch 1 ltr
5255,Queso blanco tregar pot 300 grm
5256,Leche entera sancor larga vida c/hierro vit c n.tambos 1ltr
5257,Leche infantil sancor bebe 2 nutricion completa ttb 500 ml
5258,Yogur bebible entero yogurisimo frutilla sch 1300 g
5259,Arroz con leche tregar con dulce de leche pot 180 grm
5260,Postre danette alfajor pot 120 grm
5261,Yogur descremado ser joyful durazno pot 125 grm
5262,Postre shimy vainilla pot 120 grm
5263,Flan light ser vainilla pack 190 grm
5264,Queso untable philadelphia fat free pot 226 grm
5265,Leche chocolatada fortificada cindor ttb 1 ltr
5266,Grasa vacuna reciento sch 500 grm
5267,Postre sublime chocolate  c/ alm/av pot 110 grm
5268,Queso untable light sancor por salut pot 190 grm
5269,Leche infantil nutrilon profutura 3 ttb 1 ltr
5270,Yogur entero sancor yogs multinutr frutilla pot 190 grm
5271,Yogur bebible entero sancor yogs vainilla bot 1000 grm
5272,Leche entera sancor c/ vitam a/d/ b9 ttb 1 ltr
5273,Yogur bebible descremado tregar vainilla sch 900 grm
5274,Dulce de leche la lacteo tradicional pot 250 grm
5275,Postre serenito combinado choc dulce de le serenito pot 120 g
5276,Postre chocolate y al danette pot 95 grm
5277,Leche entera ciudad del lago l/v vit.a/d ttb 1 ltr
5278,Yogur descremado ser cereales con miel pot 165 grm
5279,Flan danette vainilla pack 2 uni 190 grm
5280,Yogur bebible descremado ser vainilla ttb 1000 grm
5281,Margarina danica dorada vitamina a/d/e pan 200 grm
5282,Queso untable veronica gruyere pot 190 grm
5283,Alim. infantil base leche junior manzana sch 1 ltr
5284,Yogur bebible entero milkaut durazno fortificado sch 1 kgm
5285,Yogur cremoso entero sancor yogs vainilla pak 240 grm
5286,Yogur bebible descremado ser pas. de frut rojos sch 960 grm
5287,Leche descremada veronica l/v ttb 1 ltr
5288,Leche chocolatada sancor 1 ltr pack 6 uni
5289,Manteca tonadita pan 200 grm
5290,Dulce de leche repostero sancor tradicional pot 400 grm
5291,Leche infantil sancor bebe 1 nutricion completa ttb 500 ml
5292,Queso untable light tholem tentac jamon d sierra pot 190g
5293,Ricotta descremada tregar magna pot 300 grm
5294,Leche entera c/vitamina c la serenisi sch 1 ltr
5295,Queso untable light sancor por salut pot 290 grm
5296,Leche descremada ciudad del lago l/v vit. a/d ttb 1 ltr
5297,Yogur batido entero yogurisimo cremix frutilla sch 960 grm
5298,Yogur entero yogurisimo c/cere energia total pot 166 grm
5299,Yogur bebible entero yogurisimo vainilla bot 185 gr
5300,Queso untable tregar mascarpone pot 200 grm
5301,Crema de leche tregar pot 200 cc
5302,Margarina danica dorada vitamina a/d/e pan 500 grm
5303,Alimento lacteo danonino frutilla danoformis bot 185 gr
5304,Yogur batido entero yogurisimo cremix  frutilla pak 480 grm
5305,Yogur entero coto firme frutilla pak 2 u 125 grm
5306,Yogur bebible descremado sanco multiv.vainilla sch 900 grm
5307,Alim. base leche descremada seremix frutas tropic sch 1 lt
5308,Dulce de leche la serenisima f/calcio e/colonial pot 1 kg
5309,Leche fermentada actimel 0% multifruta vita pack 6 u 600 g
5310,Leche descremada la serenisima deslactosad nar-dur brk 500 cc
5311,Queso untable light finlandia jamon/parmesa vit a/d pot 200g
5312,Yogur entero dahi natural c/ azucar fra 200 grm
5313,Leche infantil 1 plus crecer ttb 200 ml
5314,Yogur batido entero dahi c/ frutos bosque fra 200 grm
5315,Leche infantil enfabebe premium 3 ttb 200 ml
5316,Alim. infantil base leche junior frutilla sch 1 ltr
5317,Leche chocolatada shimy ttb 1 ltr
5318,Yogur descremado firme coto frutilla pak 2 uni 125 grm
5319,Queso untable light tholem tentacion 4 quesos pot 190 grm
5320,Yogur descremado ser c/pulpa frutilla pot 180 grm
5321,Leche infantil enfabebe premium 2 ttb 500 ml
5322,Manteca tonadita pan 100 grm
5323,Queso untable milkaut por salut pot 190 grm
5324,Queso untable la paulina clasico pot 190 grm
5325,Leche descremada la serenisima c/ hierro vit a/c/d/b9 sch 1lt
5326,Queso untable la paulina cheddar pot 190 grm
5327,Manteca sancor baja en sodio c/vitamina a pan 200 grm
5328,Yogur entero tregar c/frutilla pot 160 grm
5329,Yogur bebible entero yogurisimo frutilla ttb 1000gr
5330,Yogur batido entero yogurisimo pachorra nat c/redon pot 162 g
5331,Yogur entero yogurisimo firme vainilla pak 4 uni 500 grm
5332,Yogur cremoso entero sancor yogs fram/frut/mor pak 240 grm
5333,Alim. base leche descremada serecol nja  dur sqa 1 ltr
5334,Dulce de leche veronica pot 400 grm
5335,Port salut vacalin light paq 400 grm
5336,Leche infantil sancor bebe 1 nutricion completa ttb 200 ml
5337,Alim. base leche descremada serecol manzan sqa 1 ltr
5338,Postre ser dulce de leche pak 200 grm
5339,Yogur firme descremado ser frutilla pot 195 grm
5340,Leche entera la serenisima deslactosada ttb 500 cc
5341,Postre serenito la copa chocolate pot 100 grm
5342,Ricotta magra la serenisima baja en sodio sch 500 grm
5343,Queso untable tholem tentacion cheddar pot 190 grm
5344,Yogur entero sancor yogs firme mult ddll pack 2 250 grm
5345,Dulce de leche san ignacio familiar pot 200 grm
5346,Margarina delicia pan 500 grm
5347,Yogur bebible entero dahi banana bot x 200 grm
5348,Margarina manty light pan 200 grm
5349,Leche descremada sancor lv c/fibra/fort vit n tambos 1ltr
5350,Leche entera la serenisima hierro vit a/c/d/b9 ctn 1 ltr
5351,Ricotta entera tregar pot 300 grm
5352,Dulce de leche san ignacio lat 1 kg
5353,Postre shimy chocolate/ dulce de leche pot 120 grm
5354,Queso untable tholem tentaciones clasico pot 190 gr
5355,Alimento lacteo danonino frutilla danoform 4 un 400 grm
5356,Queso untable tregar neufchatel jamon pot 190 grm
5357,Queso untable caesar finlandia pot 200 grm
5358,Creme de leche veronica pot 360 cmq
5359,Yogur bebible entero yogurisim frutilla a la crema sch 1 kgm
5360,Leche infantil vital 3 nutriplus ttb 1 ltr
5361,Postre danette dulce de leche pak 380 grm
5362,Queso crema la paulina light pot 290 grm
5363,Leche fermentada actimel frutilla vitam d x6  600 grm
5364,Leche chocolatada cindor ttb 250 cc
5365,Yogur bebible descremado sancor yogs vainilla bot 185 g
5366,Leche infantil nutrilon profutura 4 ttb 1 ltr
5367,Dulce de leche la serenisima fuente de calcio pot 400 grm
5368,Dulce de leche san ignacio pot 1 kg
5369,Dulce de leche 0% grasa y colesterol sancor pot 400 grm
5370,Leche entera serenisima ultra extra calcio dha sch 1 lt
5371,Yogur bebible descremado ser vainilla sch 1000 grm
5372,Crema de leche milkaut pot 360 cc
5373,Dulce de leche sancor pot 1 kg
5374,Dulce de leche repostero la serenisima f/calcio 500 grm
